{
  "manifestId": "RR-EXM-596650d2ade2",
  "manifestKey": "596650d2ade25a614657b7070aa44efa1a917f26b1c71fe15a905a21bf0453c2",
  "manifestHash": "d223ae3f261ff9955b907a49b32f35aed0e63f15e63d2898774114ec1f77d758",
  "createdAt": "2026-09-03T00:00:00.000Z",
  "schemaVersion": 1,
  "kind": "execution-manifest",
  "reviewRunId": "2026-09-03T00-00-00-000Z-def456",
  "riverReview": {
    "status": "resolved",
    "version": "1.91.0"
  },
  "plugin": {
    "status": "resolved",
    "host": "claude-code",
    "pluginVersion": "1.91.0"
  },
  "flow": {
    "status": "missing",
    "id": null,
    "version": null,
    "sha256": null
  },
  "agents": {
    "status": "missing",
    "entries": []
  },
  "skills": {
    "status": "missing",
    "entries": [
      {
        "id": "requirements-consistency",
        "version": "1",
        "sha256": null
      }
    ],
    "skillSetHash": "58f333b61f0dffcaacbd1ed1d7f845346a2e15fdef2270c26a7700db3941ceb2"
  },
  "artifacts": {
    "status": "missing",
    "entries": []
  },
  "policy": {
    "status": "missing",
    "ref": null,
    "sha256": null,
    "riskMapDigest": "0123456789abcdef"
  },
  "runtime": {
    "status": "resolved",
    "provider": "anthropic",
    "model": "claude-sonnet-4",
    "profile": null
  },
  "config": {
    "status": "missing",
    "sha256": null
  },
  "writeEffects": [],
  "redaction": {
    "applied": true,
    "hits": []
  }
}
